11:42:04.766656 IP BP-Linux8.ssh > 192.168.190.130.50019: Flags [P.], seq 2243505564:2243505672, ack 1972915080, win 312, options [nop,nop,TS val 102917262 ecr 377952805], length 108
11:42:04.766694 IP BP-Linux8.ssh > 192.168.190.130.50019: Flags [P.], seq 108:144, ack 1, win 312, options [nop,nop,TS val 102917262 ecr 377952805], length 36
11:42:04.766723 IP BP-Linux8.ssh > 192.168.190.130.50019: Flags [P.], seq 144:252, ack 1, win 312, options [nop,nop,TS val 102917262 ecr 377952805], length 108
11:42:04.766744 IP BP-Linux8.ssh > 192.168.190.130.50019: Flags [P.], seq 252:288, ack 1, win 312, options [nop,nop,TS val 102917262 ecr 377952805], length 36
11:42:04.785366 IP 192.168.190.130.50019 > BP-Linux8.ssh: Flags [.], ack 108, win 7319, options [nop,nop,TS val 377953205 ecr 102917262], length 0
11:42:04.785384 IP 192.168.190.130.50019 > BP-Linux8.ssh: Flags [.], ack 144, win 7318, options [nop,nop,TS val 377953205 ecr 102917262], length 0
11:42:04.785406 IP 192.168.190.130.50019 > BP-Linux8.ssh: Flags [.], ack 252, win 7316, options [nop,nop,TS val 377953205 ecr 102917262], length 0
11:42:04.785454 IP 192.168.190.130.50019 > BP-Linux8.ssh: Flags [.], ack 288, win 7320, options [nop,nop,TS val 377953205 ecr 102917262], length 0
11:42:05.768334 IP BP-Linux8.58466 > ns1.lan.rt.domain: 16550+ PTR? 130.190.168.192.in-addr.arpa. (46)
11:42:05.769075 IP ns1.lan.rt.domain > BP-Linux8.58466: 16550 NXDomain 0/1/0 (112)
11:42:06.669393 IP 192.168.190.130.50245 > BP-Linux8.ssh: Flags [P.], seq 1601828178:1601828214, ack 1851233244, win 2048, options [nop,nop,TS val 377955086 ecr 102913805], length 36
11:42:06.669906 IP BP-Linux8.ssh > 192.168.190.130.50245: Flags [P.], seq 1:37, ack 36, win 291, options [nop,nop,TS val 102917738 ecr 377955086], length 36
11:42:06.679262 IP BP-Linux8.53220 > ns1.lan.rt.domain: 54801+ A? lacampora.org. (31)
11:42:06.679971 IP ns1.lan.rt.domain > BP-Linux8.53220: 54801 1/0/0 A 184.107.43.74 (47)
11:42:06.681188 IP BP-Linux8.ssh > 192.168.190.130.50245: Flags [P.], seq 37:153, ack 36, win 291, options [nop,nop,TS val 102917741 ecr 377955086], length 116
11:42:06.681222 IP BP-Linux8.ssh > 192.168.190.130.50245: Flags [P.], seq 153:189, ack 36, win 291, options [nop,nop,TS val 102917741 ecr 377955086], length 36
11:42:06.681248 IP 190-0-175-100.gba.solunet.com.ar.2465 > 184.107.43.74.http: Flags [S], seq 326991629:326991749, win 512, length 120: HTTP
11:42:06.681274 IP 190-0-175-100.gba.solunet.com.ar.2466 > 184.107.43.74.http: Flags [S], seq 920517760:920517880, win 512, length 120: HTTP
11:42:06.681294 IP 190-0-175-100.gba.solunet.com.ar.2467 > 184.107.43.74.http: Flags [S], seq 556803824:556803944, win 512, length 120: HTTP
11:42:06.681312 IP 190-0-175-100.gba.solunet.com.ar.2468 > 184.107.43.74.http: Flags [S], seq 1921632185:1921632305, win 512, length 120: HTTP
11:42:06.681328 IP 190-0-175-100.gba.solunet.com.ar.2469 > 184.107.43.74.http: Flags [S], seq 1170972654:1170972774, win 512, length 120: HTTP
11:42:06.681345 IP 190-0-175-100.gba.solunet.com.ar.2470 > 184.107.43.74.http: Flags [S], seq 754504426:754504546, win 512, length 120: HTTP
11:42:06.681362 IP 190-0-175-100.gba.solunet.com.ar.2471 > 184.107.43.74.http: Flags [S], seq 669863147:669863267, win 512, length 120: HTTP
11:42:06.681379 IP 190-0-175-100.gba.solunet.com.ar.2472 > 184.107.43.74.http: Flags [S], seq 1036593434:1036593554, win 512, length 120: HTTP
11:42:06.681396 IP 190-0-175-100.gba.solunet.com.ar.2473 > 184.107.43.74.http: Flags [S], seq 473640609:473640729, win 512, length 120: HTTP
11:42:06.681413 IP 190-0-175-100.gba.solunet.com.ar.2474 > 184.107.43.74.http: Flags [S], seq 294639309:294639429, win 512, length 120: HTTP
11:42:06.681430 IP 190-0-175-100.gba.solunet.com.ar.2475 > 184.107.43.74.http: Flags [S], seq 2003734750:2003734870, win 512, length 120: HTTP
11:42:06.681446 IP 190-0-175-100.gba.solunet.com.ar.2476 > 184.107.43.74.http: Flags [S], seq 943277646:943277766, win 512, length 120: HTTP
11:42:06.681463 IP 190-0-175-100.gba.solunet.com.ar.2477 > 184.107.43.74.http: Flags [S], seq 612921749:612921869, win 512, length 120: HTTP
11:42:06.681480 IP 190-0-175-100.gba.solunet.com.ar.2478 > 184.107.43.74.http: Flags [S], seq 1079269685:1079269805, win 512, length 120: HTTP
11:42:06.681497 IP 190-0-175-100.gba.solunet.com.ar.2479 > 184.107.43.74.http: Flags [S], seq 1427118982:1427119102, win 512, length 120: HTTP
11:42:06.681514 IP 190-0-175-100.gba.solunet.com.ar.2480 > 184.107.43.74.http: Flags [S], seq 1481846896:1481847016, win 512, length 120: HTTP
11:42:06.681531 IP 190-0-175-100.gba.solunet.com.ar.2481 > 184.107.43.74.http: Flags [S], seq 807245684:807245804, win 512, length 120: HTTP
11:42:06.681548 IP 190-0-175-100.gba.solunet.com.ar.2482 > 184.107.43.74.http: Flags [S], seq 29032482:29032602, win 512, length 120: HTTP
11:42:06.681564 IP 190-0-175-100.gba.solunet.com.ar.2483 > 184.107.43.74.http: Flags [S], seq 2121432424:2121432544, win 512, length 120: HTTP
11:42:06.681581 IP 190-0-175-100.gba.solunet.com.ar.2484 > 184.107.43.74.http: Flags [S], seq 266983944:266984064, win 512, length 120: HTTP
11:42:06.681597 IP 190-0-175-100.gba.solunet.com.ar.2485 > 184.107.43.74.http: Flags [S], seq 780253659:780253779, win 512, length 120: HTTP
11:42:06.681614 IP 190-0-175-100.gba.solunet.com.ar.2486 > 184.107.43.74.http: Flags [S], seq 426927737:426927857, win 512, length 120: HTTP
11:42:06.681630 IP 190-0-175-100.gba.solunet.com.ar.2487 > 184.107.43.74.http: Flags [S], seq 2059846495:2059846615, win 512, length 120: HTTP
11:42:06.681647 IP 190-0-175-100.gba.solunet.com.ar.2488 > 184.107.43.74.http: Flags [S], seq 485695892:485696012, win 512, length 120: HTTP
11:42:06.681664 IP 190-0-175-100.gba.solunet.com.ar.2489 > 184.107.43.74.http: Flags [S], seq 1506899314:1506899434, win 512, length 120: HTTP
11:42:06.681681 IP 190-0-175-100.gba.solunet.com.ar.2490 > 184.107.43.74.http: Flags [S], seq 1974670292:1974670412, win 512, length 120: HTTP
11:42:06.681697 IP 190-0-175-100.gba.solunet.com.ar.2491 > 184.107.43.74.http: Flags [S], seq 984948282:984948402, win 512, length 120: HTTP
11:42:06.681722 IP 190-0-175-100.gba.solunet.com.ar.2492 > 184.107.43.74.http: Flags [S], seq 2071134208:2071134328, win 512, length 120: HTTP
11:42:06.681739 IP 190-0-175-100.gba.solunet.com.ar.2493 > 184.107.43.74.http: Flags [S], seq 582048290:582048410, win 512, length 120: HTTP
11:42:06.681756 IP 190-0-175-100.gba.solunet.com.ar.2494 > 184.107.43.74.http: Flags [S], seq 1414722580:1414722700, win 512, length 120: HTTP
11:42:06.681773 IP 190-0-175-100.gba.solunet.com.ar.2495 > 184.107.43.74.http: Flags [S], seq 1376167161:1376167281, win 512, length 120: HTTP
11:42:06.681789 IP 190-0-175-100.gba.solunet.com.ar.2496 > 184.107.43.74.http: Flags [S], seq 793373662:793373782, win 512, length 120: HTTP
11:42:06.681806 IP 190-0-175-100.gba.solunet.com.ar.2497 > 184.107.43.74.http: Flags [S], seq 586859843:586859963, win 512, length 120: HTTP
11:42:06.681823 IP 190-0-175-100.gba.solunet.com.ar.2498 > 184.107.43.74.http: Flags [S], seq 1313429529:1313429649, win 512, length 120: HTTP
11:42:06.681839 IP 190-0-175-100.gba.solunet.com.ar.2499 > 184.107.43.74.http: Flags [S], seq 599747608:599747728, win 512, length 120: HTTP
11:42:06.681856 IP 190-0-175-100.gba.solunet.com.ar.2500 > 184.107.43.74.http: Flags [S], seq 1764270382:1764270502, win 512, length 120: HTTP
11:42:06.681872 IP 190-0-175-100.gba.solunet.com.ar.2501 > 184.107.43.74.http: Flags [S], seq 1266534982:1266535102, win 512, length 120: HTTP
11:42:06.681889 IP 190-0-175-100.gba.solunet.com.ar.2502 > 184.107.43.74.http: Flags [S], seq 1923888203:1923888323, win 512, length 120: HTTP
11:42:06.681906 IP 190-0-175-100.gba.solunet.com.ar.2503 > 184.107.43.74.http: Flags [S], seq 477956184:477956304, win 512, length 120: HTTP
11:42:06.681924 IP 190-0-175-100.gba.solunet.com.ar.2504 > 184.107.43.74.http: Flags [S], seq 1697346829:1697346949, win 512, length 120: HTTP
11:42:06.681941 IP 190-0-175-100.gba.solunet.com.ar.2505 > 184.107.43.74.http: Flags [S], seq 1581732153:1581732273, win 512, length 120: HTTP
11:42:06.681958 IP 190-0-175-100.gba.solunet.com.ar.2506 > 184.107.43.74.http: Flags [S], seq 2134846905:2134847025, win 512, length 120: HTTP
11:42:06.681975 IP 190-0-175-100.gba.solunet.com.ar.2507 > 184.107.43.74.http: Flags [S], seq 5001436:5001556, win 512, length 120: HTTP
11:42:06.681992 IP 190-0-175-100.gba.solunet.com.ar.2508 > 184.107.43.74.http: Flags [S], seq 100084791:100084911, win 512, length 120: HTTP
11:42:06.682008 IP 190-0-175-100.gba.solunet.com.ar.2509 > 184.107.43.74.http: Flags [S], seq 1351883007:1351883127, win 512, length 120: HTTP
11:42:06.682025 IP 190-0-175-100.gba.solunet.com.ar.2510 > 184.107.43.74.http: Flags [S], seq 892547770:892547890, win 512, length 120: HTTP
11:42:06.682041 IP 190-0-175-100.gba.solunet.com.ar.2511 > 184.107.43.74.http: Flags [S], seq 203925976:203926096, win 512, length 120: HTTP
11:42:06.682058 IP 190-0-175-100.gba.solunet.com.ar.2512 > 184.107.43.74.http: Flags [S], seq 93263311:93263431, win 512, length 120: HTTP
11:42:06.682075 IP 190-0-175-100.gba.solunet.com.ar.2513 > 184.107.43.74.http: Flags [S], seq 589592255:589592375, win 512, length 120: HTTP
11:42:06.682092 IP 190-0-175-100.gba.solunet.com.ar.2514 > 184.107.43.74.http: Flags [S], seq 1666861586:1666861706, win 512, length 120: HTTP
11:42:06.682108 IP 190-0-175-100.gba.solunet.com.ar.2515 > 184.107.43.74.http: Flags [S], seq 1444571600:1444571720, win 512, length 120: HTTP
11:42:06.682125 IP 190-0-175-100.gba.solunet.com.ar.2516 > 184.107.43.74.http: Flags [S], seq 702975955:702976075, win 512, length 120: HTTP
11:42:06.682152 IP 190-0-175-100.gba.solunet.com.ar.2517 > 184.107.43.74.http: Flags [S], seq 2016486038:2016486158, win 512, length 120: HTTP
11:42:06.682172 IP 190-0-175-100.gba.solunet.com.ar.2518 > 184.107.43.74.http: Flags [S], seq 1002497398:1002497518, win 512, length 120: HTTP
11:42:06.682191 IP 190-0-175-100.gba.solunet.com.ar.2519 > 184.107.43.74.http: Flags [S], seq 294189577:294189697, win 512, length 120: HTTP
11:42:06.682210 IP 190-0-175-100.gba.solunet.com.ar.2520 > 184.107.43.74.http: Flags [S], seq 1398461889:1398462009, win 512, length 120: HTTP
11:42:06.682227 IP 190-0-175-100.gba.solunet.com.ar.2521 > 184.107.43.74.http: Flags [S], seq 1995017329:1995017449, win 512, length 120: HTTP
11:42:06.682243 IP 190-0-175-100.gba.solunet.com.ar.2522 > 184.107.43.74.http: Flags [S], seq 921320533:921320653, win 512, length 120: HTTP
11:42:06.682259 IP 190-0-175-100.gba.solunet.com.ar.2523 > 184.107.43.74.http: Flags [S], seq 248505708:248505828, win 512, length 120: HTTP
11:42:06.682276 IP 190-0-175-100.gba.solunet.com.ar.2524 > 184.107.43.74.http: Flags [S], seq 558621145:558621265, win 512, length 120: HTTP
11:42:06.682292 IP 190-0-175-100.gba.solunet.com.ar.2525 > 184.107.43.74.http: Flags [S], seq 1118905776:1118905896, win 512, length 120: HTTP
11:42:06.682308 IP 190-0-175-100.gba.solunet.com.ar.2526 > 184.107.43.74.http: Flags [S], seq 1158043116:1158043236, win 512, length 120: HTTP
11:42:06.682325 IP 190-0-175-100.gba.solunet.com.ar.2527 > 184.107.43.74.http: Flags [S], seq 1469406826:1469406946, win 512, length 120: HTTP
11:42:06.682341 IP 190-0-175-100.gba.solunet.com.ar.2528 > 184.107.43.74.http: Flags [S], seq 492373102:492373222, win 512, length 120: HTTP
11:42:06.682357 IP 190-0-175-100.gba.solunet.com.ar.2529 > 184.107.43.74.http: Flags [S], seq 1687855121:1687855241, win 512, length 120: HTTP
11:42:06.682374 IP 190-0-175-100.gba.solunet.com.ar.2530 > 184.107.43.74.http: Flags [S], seq 1360633195:1360633315, win 512, length 120: HTTP
11:42:06.682390 IP 190-0-175-100.gba.solunet.com.ar.2531 > 184.107.43.74.http: Flags [S], seq 1274977706:1274977826, win 512, length 120: HTTP
11:42:06.682407 IP 190-0-175-100.gba.solunet.com.ar.2532 > 184.107.43.74.http: Flags [S], seq 549939990:549940110, win 512, length 120: HTTP
11:42:06.682423 IP 190-0-175-100.gba.solunet.com.ar.2533 > 184.107.43.74.http: Flags [S], seq 1109408249:1109408369, win 512, length 120: HTTP
11:42:06.682439 IP 190-0-175-100.gba.solunet.com.ar.2534 > 184.107.43.74.http: Flags [S], seq 1283855019:1283855139, win 512, length 120: HTTP
11:42:06.682455 IP 190-0-175-100.gba.solunet.com.ar.2535 > 184.107.43.74.http: Flags [S], seq 623143483:623143603, win 512, length 120: HTTP
11:42:06.682472 IP 190-0-175-100.gba.solunet.com.ar.2536 > 184.107.43.74.http: Flags [S], seq 709005792:709005912, win 512, length 120: HTTP
11:42:06.682488 IP 190-0-175-100.gba.solunet.com.ar.2537 > 184.107.43.74.http: Flags [S], seq 1528805205:1528805325, win 512, length 120: HTTP
11:42:06.682504 IP 190-0-175-100.gba.solunet.com.ar.2538 > 184.107.43.74.http: Flags [S], seq 940059508:940059628, win 512, length 120: HTTP
11:42:06.682521 IP 190-0-175-100.gba.solunet.com.ar.2539 > 184.107.43.74.http: Flags [S], seq 1190337142:1190337262, win 512, length 120: HTTP
11:42:06.682537 IP 190-0-175-100.gba.solunet.com.ar.2540 > 184.107.43.74.http: Flags [S], seq 1484037464:1484037584, win 512, length 120: HTTP
11:42:06.682553 IP 190-0-175-100.gba.solunet.com.ar.2541 > 184.107.43.74.http: Flags [S], seq 566224598:566224718, win 512, length 120: HTTP
11:42:06.682570 IP 190-0-175-100.gba.solunet.com.ar.2542 > 184.107.43.74.http: Flags [S], seq 788308167:788308287, win 512, length 120: HTTP
11:42:06.682586 IP 190-0-175-100.gba.solunet.com.ar.2543 > 184.107.43.74.http: Flags [S], seq 96067834:96067954, win 512, length 120: HTTP
11:42:06.682602 IP 190-0-175-100.gba.solunet.com.ar.2544 > 184.107.43.74.http: Flags [S], seq 1226579504:1226579624, win 512, length 120: HTTP
11:42:06.682619 IP 190-0-175-100.gba.solunet.com.ar.2545 > 184.107.43.74.http: Flags [S], seq 1551737466:1551737586, win 512, length 120: HTTP

